word,corpus1_sentences,corpus2_sentences,annotation
investigation_nn,whether from the difficulty of procure information in reference to these interesting event or from neglect of **investigation** on our        ||        only one skull incontestably belong to this race be recover entire in the course of these **investigation**        ||        extensive **investigation** have be make in france in reference to this point        ||        when member thus volunteer to inform the world it surely be but fair to hold them responsible for the veracity of their fact when these be open for **investigation**        ||        she be fearful lest the **investigation** might result to her prejudice and then miss holyoke might be scrupulous about retain her in her strictly genteel establishment,on a case-by-case basis by diligent competent **investigation**        ||        davis serve on a separate state pension board -- the illinois state board of investment -- that also have be under federal **investigation**        ||        could have be a bland disease-of-the-week exercise like nbc 's stultify medical **investigation**        ||        it say an **investigation** by soviet expert of available data have incontrovertibly establish that mr.-        ||        lots of people -- a few veterinarian include -- be demand that someone give this method serious **investigation**,0
defense_nn,to the bush whereunto while the sheep fly for **defense** in weather he be sure to lose part of the fleece '        ||        tortesa tortesa retreat on the **defense**        ||        their prospect of make a successful **defense** be it be true hopeless        ||        the besieged now assemble in force to the **defense** of their post        ||        chesterfield feel the rebuke to be too just ever to indulge in such hollow excuse as have be lately set up in his **defense**,"-- troop active 620,000 reserve 513,000 -- paramilitary force <nul> 288,000 -- army tank 2,300 artillery 1,830 armored personnel carrier 1,150 -- air force combat aircraft 353 including 6 ground attack squadron and 12 fighter squadron but no armed helicopter -- navy submarine 10 surface combatant 8 frigate -- missile short-range m-11 -- 280-km range/800-kg payload hatf-1 -- 80-km to 100-km range/500-kg payload shaheen-1 -- 750-km range/500-kg payload medium-range ghauri-1 -- 1,300+-km range/700-kg payload india -- **defense** budget 2001 $15.6 billion -- nuclear warhead 45 to 95 est        ||        nfl rank colt offense 28th rush 28th pass 16th **defense** 24th rush 22nd pass 22nd        ||        nfl rank seahawk offense 20th rush 17th pass 18th **defense** 14th rush 13th pass 13th        ||        nfl rank buccaneer offense 12th rush 13th pass 14th **defense** 19th rush 18th pass 16th        ||        cardinal offense 21st rush 9th pass 28th **defense** 18th rush 27th pass 10th",0
associate_nn,recollect we must not lose time say mallex see that his **associate** seem to be root to the spot        ||        the stranger do not too closely follow on the heel of his **associate**        ||        economy of **associate** labor and expense to make every member rich on the same amount of property that in separate family would leave every member poor        ||        she be too proud and too generous to involve other in the consequence of **associate** with one whose respectability be doubt        ||        pass the zemilian bridge where the **associate** of catiline be take prisoner we ente * red the city by the porta del popolo,"peo -- ple be fanatical about rockwell and any -- thing **associate** with him        ||        they finish 17th in the final **associate** press poll last year with an 11-2 record - best in school history - and rank ahead of national big-timers washington texas a &m, and syracuse        ||        it end with shaffer and barrera and their **associate** as counsel for the boy be join at one table by a rather reluc -- tant ally -- the attorney for the inter -- nal revenue service        ||        and that the other man around it be partner and **associate** of addy        ||        he be mr.- clean say a longtime **associate**",0
count_nn,one never know when you be in earnest **count**        ||        john <nul> john flitch point to the **count**        ||        i want to give a tte tte to the **count**        ||        but the **count** beg him to excuse his emotion        ||        trust none trust none **count** charles,"$50 90-**count** bottle contact <nul> 7        ||        now put that on my **count** aunt amanda say        ||        that first evening at the hospital on february 1 1973 our 19-year-old laughter linda 's white-cell **count** be 98,000 and climbing        ||        it be the quality that **count** say karras        ||        but they inbounded the ball to santos and he take it down the length of the floor the clock **count** down 5-4-3-2-1",1
stare_nn,she have never be in such a place before and it make her cheek very hot to have those rude girl **stare** at her so        ||        as you enter the passage it **stare** upon you on one side ready to entrap all guest        ||        why sit ye **stare** like monk between the hour of prayer and dinner        ||        the boy thrust their hand deep in their trouser ' pocket and with mouth wide open **stare** in speechless wonder        ||        at first he **stare** at me as if he find it impossible to comprehend the witticism of my remark but as its point seem slowly to make its way into his brain his eye in the same proportion seem protrude from their socket,|p258i **stare** at him and i say nothing        ||        i could n't answer but sim -- ply **stare**        ||        he **stare** at the eye that be **stare** at him        ||        mrs.- kawaguchi frown and **stare** at the can        ||        and **stare** down at the talmud and shake his head,0
market_nn,for ourselves we look exclusively for encouragement and support to the home **market**        ||        in spite of the cruiser the **market** have be svpjilied        ||        because there have be no **market** for such work if they have be produce        ||        it become a commodity worth in the **market** from ten to twelve per cent        ||        until recently new orleans be the focal species **market** of the south,fort worth rail **market** fort worth tx 817 335-6758        ||        the farmer ' **market** season -- 1997 district of columbia adams-morgan farmer ' **market** columbia road and 18th street nw 814-448-3904        ||        1/2 to 21 3/4 a 310 100-share block handle in the over-the-counter **market** by jeffery trade at 22        ||        moscow enclose **market** -- day 306 a security guard -- hear the commotion -- jog out and delete 307 308 ext        ||        22033 703-218-6000 www.mantech.com found 1968 revenue $701.60 million net income $35.16 million earnings per share $1.09 dividend none stockholder equity $287.70 million auditor deloitte &; touche llp stock mant nasdaq asset $436.13 million **market** capitalization $699.06 million 52-week high $28.31 9/19/2003 52-week low $12.87 12/17/2003 chairman president and ceo george j.-a pedersen cfo,0
duck_nn,i hope he may get a **duck** before he reach the hovel        ||        the eden of tennessee the editor 's excursion **duck** river or what be in a name        ||        a **duck** pie may be make in the same manner        ||        his form be different from all the **duck** i have see        ||        if the player who be **duck** can touch /q/ him after he have take up his pebble and before he reach the offing provide his own pebble remain on the large stone then the player so touch become **duck**,u.s.- hunter from 1980 to 1985 annually kill about 1.9 million goose and 9.6 million **duck**        ||        in several place a road start in the u.s.- poke into canada and **duck** back into the state        ||        it be a man who be quack like a **duck**        ||        find a **duck** motif and a preppy can not be far away        ||        boss what be that about not shoot **duck** on water,0
border_nn,the soil which **border** it // be extremely fertile        ||        on the **border** of these wood you may see her home        ||        /z/ the **border** should be keep at all time clear from weed        ||        when he be ten or eleven year old he be put under the government of a respectable teacher who keep an academy on the **border** of the mountain country where he spend several year of his life        ||        one day soon after we be walk together over the rough rock **border** the shore,"the old world fade away -- salsa be more popular than ketchup salma hayek be big than madonna -- and the **border** be everywhere        ||        iraq have no contiguous **border** with israel but its fanatically anti-israel baathist government maintain an 18,000-man expeditionary force        ||        as of last july a total of 5,438 pound of cfc- 12 have be seize along the southern **border** and 2,700 pound of cfc- 12 have be take in the south florida area he say        ||        enjoy three- to five-day trip through the eagle cap wilderness near the oregon -- idaho **border**        ||        an estimate 50,000 to 60,000 additional russian troop be mass on chechnya 's **border** await the order to move",0
agreement_nn,the **agreement** between these two man intellectually seem to have be complete in almost every particular        ||        where be mr.- chesterton we must not let him hear the **agreement**        ||        there would be no remedy for he would violate no **agreement**        ||        this **agreement** sir of which we speak i be prepare        ||        we part therefore with an **agreement** to meet the night before court in fredericksburg,most palestinian -- 69% by one survey -- approve of the **agreement** when it be make        ||        watts say the affair end in 1985 by mutual **agreement**        ||        transform to space-ship time obtain the interval 22.2 x 10-8 sec in **agreement** with prob        ||        and bonding company make an out-of-court **agreement** to settle claim        ||        reach an **agreement** on a two-year-pact that be expect to set the patter ' for the industry,0
health_nn,ye be like her but ye have better **health**        ||        they keep their beauty because they keep their **health**        ||        i accept your offer reply the other here be her **health**        ||        not these how may we preserve the **health** of either        ||        there never be upon the whole more **health** with so much life,another ad -- the u.s.- **health**-care system <nul> the canadian system        ||        or 10 ppm no3 - xx_n u.s.- public **health** // service 1962        ||        confounding variable -- such as poverty and lack of **health** care -- that can cloud the meaning of data        ||        20814 301-951-6122 www.american-capital.com found 1986 revenue $206.28 million net income $117.98 million earnings per share $2.15 dividend $2.79 stockholder equity $1.18 billion auditor ernst &; young llp stock acas nasdaq asset $2.04 billion market capitalization $2.06 billion 52-week high $34.91 2/18/2004 52-week low $20.75 8/15/2003 chairman and ceo malon wilkus coo ira wagner employee 132 local employee 50 description american capital strategy invest in and lend money to medium-size company in transportation construction **health** care and retailing        ||        for a free copy of the green sheet -- a report that rate sanitation on all cruise ship that call at foreign and u.s.- port -- write to the u.s.- public **health** service 1015 <nul> american way room 107 miami <nul> 33132,0
patient_nn,there be no rebellion here but the most **patient** endurance        ||        it be then our business to keep up the **patient** 's heart        ||        these be the day room of the **patient** where they be expect to remain during all their wake hour while they be in the house        ||        12 * // lie can not look on her mild eye her **patient** word his spirit quell        ||        yes doctor i will do my very best for your **patient**,build a gothic-style cathedral out of hand-worked masonry take a while -- a few decade here a few decade there -- and mr.- bambridge look and act like a **patient** man        ||        and the survival rate for **patient** with advanced breast cancer -- an average of two year -- have n't change appreciably        ||        allawi be a man of principal clear-minded and **patient**        ||        i have one **patient** in his mid-40s who over a year and a        ||        the once-sacred relationship between doctor and **patient** have deteriorate in many case into an impersonal -- and often adversarial -- business transaction,0
folk_nn,she be with her **folk** be she        ||        yes ' say i only some **folk** i suppose will set up a squeelin        ||        you must come over and see our **folk** over the other        ||        well i do like to see young **folk** enjoy themselves say the dame        ||        well **folk** what be ye about here,"28,800 asian american dance perfor- 24,000 mances -- asian american theater <nul> 41,800 asian improv art 12,000 bailes flamencos 22,770 for woman in the art 53,000 california contemporary dancer 5,000 capp street project 36,000 cartoon art museum 34,000 carnaval meca 107,500 chinatown merchant associ- 30,300 ation/autumn moon festival -- chinese chamber of commerce/ 77,000 chinese new year parade -- chinese cultural production 19,000 chinese culture foundation 95,000 chinese **folk** dance association 8,300 cinco de mayo meca 42,000 cine accion 12,300 city art        ||        hey get them while they last **folk** a unique once-in-a- lifetime program of the all-star game that never be play        ||        bam you sho ' do hate a heapa **folk**        ||        class and attitude that have offend against the **folk** ' code may be actually outlaw        ||        he make **folk** feel special because he make them love",0
risk_nn,"a man sit as many **risk** as he run        ||        hunger tempt him to run the **risk** of exposure        ||        hester prynne nevertheless the lonely mother of this one child run little **risk** of er on the side of undue severity        ||        elgina for me he **risk** his life for me he die        ||        if the company receive three dollar for every $100 insure they would receive $3000 and have the **risk** of $100,000",high **risk** -- but we be able to do it        ||        cowher talk about be a **risk**-taker and i be not really a **risk**-taker        ||        innings at age 22 and willis +52 at 21 though off to good start be also at **risk**-at least for a drop-off this season        ||        a vaccine - **risk** information package be available for $7        ||        $6 million -- for conceive of the idea and **risk** its capital,0
move_nn,the people know not the power that **move** them thus        ||        soul be **move** i never see one of them thing before say she        ||        suffer together in poverty seem to **move** him        ||        smile stewel as he **move** to the door        ||        he **move** come nearer he be die he can not live long,camera **move** to find -- -- the storm door bolt        ||        side street/parking area -- goa/beachtown -- day a16 * kirill now park and out of the car -- on the **move** -- on * foot -- he begin a sweep of the beach        ||        camera **move** in on tombstone which read swannaugust 2 1910 - may 12 1958 at peace        ||        19 a wrong **move** -- a **move** of any kind and he be dead        ||        - that be the indicate **move** danestar say,0
band_nn,the wise 111*11 in your **band** what be he        ||        slow in the moon 210 my little boy 211 my little boy alt cross reference src= <nul> border=0215 mrs.- partington on remedy 219 a new instrument 219 criticism 220 bleak house 221 admiration for eloquence 221 nave of the crystal palace 222 mr.- bisbee 's confession 223 germania **band** 227 a good suggestion 228 catch an omnibus 229 ike in a new position 230 unpopular doctrine 231 benevolence 232 mysterious action of rat 233 mrs.- p.-a on the mississippi 234 provision of the constitution 235 severe but just 236 mrs.- partington and piety 236 brick and straw 237 medallic prospect 237 mrs.- partington beat up 238 a dead shot 239 shocking joke 239 ride 240 mrs.- partington look out 242 foresee thing beforehand 243 a sinuosity 244 the science of fish 245 eternal indebtedness 246        ||        every question will conjure up whole troop of grisly sprights more numerous than the plandering scottish **band**        ||        on emerge from the house the prisoner find the entire **band** of their captor draw up in the yard wait only to receive them before commence the contemplate march        ||        on every side the trumpet of the general be answer by the simultaneous shout of the three **band** he have detach by the quick clatter of their,retail sales of nick-related product -- from dora backpack to spongebob **band**-aid -- top $5 billion last year        ||        but the arbuthnot-by-the-sea have its own **band** which imitate        ||        the **band** -- which play for as little as 10 a show -- want to keep the name but can n't afford a lawyer        ||        i hear him at the armory in 1941 with the dorsey **band**        ||        -- mikhail gorbachev july 1986 three u.s.- naval ship last week pull into the northern chinese port of qingdao as a 21-gun salute fire and a 27-piece brass **band** play happy day be here again,1
news_nn,o the **news** be too good to be true        ||        i shall never hear the **news** never get to the castle        ||        on the 25th he say before this i hope you have receive the agreeable **news**        ||        do you bring **news** of captain fitzroy or come you to confirm my suspicion        ||        close of the winter solstice and introduction of a northern spring -- **news** from the world -- the indian language -- narrative journal -- semi-civilization of the ancient aztec tribe -- their art and language -- hill 's ironical review of the transaction of the royal society -- a test of modern civilization -- sugar make -- trip to one of the camp -- geology of manhattan island -- ontwa an indian poem -- northern ornithology -- dream -- the indian apowa -- printed query of general cass -- prospect of the mineral agency -- exploration of the <nul> peter 's -- information on that head,"644,175 which have most of the class circulation and the tabloid daily **news** 2,021,395        ||        bad he say bad **news** makin ' it        ||        he be shake by the **news** he be receive        ||        bad **news** jaacap 7/99 new england journal of medicine 7/1/99        ||        he say that in 1966 and the **news** be even bad today",1
food_nn,one **food** the stork her house be keep        ||        but then there be other expense besides her **food**        ||        mischief be your proper element your **food** your repose your luxury        ||        the fewer mixture there be in cook the more healthful be the **food** likely to be        ||        yes the rich feel it but they feel it as we perceive the acid in our **food** only to enjoy the sweetness more,"goodfast - paris - day sasha and jonathan be at a table at this fast-**food** establishment        ||        into the capital 1,870,425 ton or 83.7 per cent be coal and 312,653 or 13.9 per cent be **food** grain        ||        where to eat/stay for help find **food** and shelter in the rural area along route 6 call the albemarle county visitor center include charlottesville at 804-977-1783 or 804-293-6789 http * 25 331 toolong or the nelson county department of tourism at 1-800-282-8223        ||        // well we could order in -- // i be try to eat healthy **food** -- pizza will n't do it        ||        * avoid high-fat diet and eat fewer salt-cured smoke and nitrite-cured **food**",0
career_nn,hear me with patience while i relate to you some of the event of sir robert 's **career** after you flee from his power        ||        here be the span of napoleon 's **career** the tree do n't seem to have mind it        ||        the summer end its short **career** the zephyr breathe farewell and now upon the closing year the yellow glory dwell        ||        on the 17th of may 1829 his long and eventful **career** be bring        ||        with his european **career** we desire at present to have little to do,vander meer be 15-10 in 1938 never win more than 18 game in a season and finish his 13-year **career** 119-121        ||        name po ht wt age exp acq college 83 arnaz battle wr 6-1 213 27 5 d6-03 notre dame **career** year in ' 06 with 59 catch 23 on 3rd down 82 darrell jackson wr 6-1 206 28 8 tr-07 florida 63 catch 10 td for seattle last season 14 c.j.-or        ||        her sister linda be 14th in **career** rebound 626 from 1976-80        ||        winston cup **career** 140 start 15 win 54 top-fives 87 top-10s eight pole 20.93 million in winning        ||        pioline 7-6 7-5 3-6 6-3 to win an all-french battle in the toulouse grand prix for his second **career** victory,0
section_nn,the evergreen be divide into three **section** 1st        ||        <temp> **section** the following be the reply receive by the insurgent        ||        the other part of this **section** seem proper object for the exclusive power of congress        ||        by article 2 **section** 2 the governor be to be choose by the elector of the member of the general assembly        ||        description he must therefore be refer to the succeeding **section** with which the story whereon this history treat be more properly commence,91-604 **section** 110(a) 2 e 84 <nul>        ||        **section** 7414(a) 1 e 1988 &; supp        ||        **section** 7410(a) 2 d i        ||        **section** 7407 1988 see train 421 u.s.- at <nul>        ||        **section** 6972(a) 1 a <nul>,0
driver_nn,of southern pine i nestle when the **driver** 's horn call to the field in lengthen line my fellow at the break of morn        ||        the swine **driver** promise he would take the first opportunity of profit by such excellent advice        ||        she must have come to stay a long time think nellie as she see the pile of baggage which the **driver** be deposit upon the stoop        ||        in truth he be overawe by the sternness of the swine **driver** 's manner and the terseness of the monosyllable with which he answer question that be subsequently put to him        ||        nobody will ever know how many say the **driver**,"voter registration 730-7072 utility electric georgia power 325-4001 gas atlanta gas light 522-1150 telephone southern bell 780-2355 water atlanta water bureau 658-6500 garbage atlanta sanitation department 330-6250 cable tv gctv 292-8822 atlanta chamber of commerce 586-8492 cherokee county cherokee county school 479-1871 **driver** license georgia state patrol office 740 marietta highway canton 720-3500 auto tag cherokee county courthouse 130 e. main <nul> canton 479-0425 cherokee county south        ||        haitian **driver** in his 30s - stand at the back of the car        ||        387 drunk drive death in 1988 licensed **driver** 164,197,000 fatal accident involve drinking **driver** 20,208 chance of **driver** be involved in fatal accident without drunk **driver** 0.0001231        ||        the car be capable of win -- the car should have win -- but the **driver** do n't do a good job        ||        one of nine child born to a panamanian bus **driver** ycaza learn to ride pony as a six-year-old train as a jockey in panama and mexico",0
glass_nn,there be some one gaze upon them from the **glass** door of yonder closet        ||        where three hive be make in one structure the **glass** for the three will cost less than 50 cent if double **glass** be not use the expense would be less by one half        ||        uncle william 's eye be glue to the **glass**        ||        crown **glass** be blow in circular table from 3 <nul> 6 <nul>        ||        on get up from table we proceed to an extensive orangerie to which three **glass** folding door open where coffee and ice be serve,"$950 for 8x43 $1,000 for 10x43 800-423-3537 bushnell.com zeiss victory 32 t * fl make in 8x32 and 10x32 this new **glass** be about as small and light both model weigh 19 ounce as be possible for a full-size binocular        ||        an easy eight **glass** a day at least        ||        coat an 8- by 12-inch **glass** baking dish with 1 tablespoon olive oil and set aside        ||        the hot dark brown liquid in the **glass** be tea -- black carpathian tea        ||        the **glass**-bead blast media - tiny spherical bead that be small than grain of sand - will n't damage the aluminum",0
