word,corpus1_sentences,corpus2_sentences,annotation
plane_nn,the perspective **plane** and be perpendicular line in the picture        ||        then the **plane** d would represent the horizon **plane**        ||        in their simple form they be the lever the wheel and axle the inclined **plane**        ||        plate 16 figure 4 represent an inclined **plane**        ||        any number of parallel line comprise between two parallel **plane** be equal,"syria have 404,000 troop 558 combat **plane** and 4,000 tank        ||        istanbul airport - day a **plane** land on a runway mark ' 2 '        ||        i pray anyplace -- in a cab on a **plane** or in the barn with the cat        ||        mr.- -- er -- frooze he say you know do n't you that we have be try to contact your **plane** all afternoon        ||        ## -- in a detroit suburb a man walk onto a private **plane** and greet the co-pilot with hi jack",1
league_nn,be there a **league** between her and the plunderer whom i have encounter        ||        i kill him your noble brother and from the moment i deliberately determine to do so i become **league** with the tempter who lure me madly on        ||        at this time we be about three **league** from the <nul>        ||        from estremoz to elvas the distance be six **league**        ||        but how be it possible the moon should compress our atmosphere which only extend they say to a score of **league** at most from us,"**league** score average average point score for select year 1984-85 - 110.8 1989-90 - 107.0 1994-95 - 101.4 1999-00 - 97.5 2000-01 - 93.8 high scoring team number of team that average more than 100 point for select year 1984-85 - 23 of 23 1989-90 - 26 of 27 1994-95 - 16 of 27 1999-00        ||        68-56 kent state 77-47 and be 4-1 in the **league**        ||        nazareth 26 chicago christian 0 joe mankiewicz 22 carry 132 yard score on run of 12 11 and 1 for nazareth 7-1 5-1 private school **league**        ||        howe 's last big **league** out be on <nul> 28 1987 his last drink <nul> 22 1989        ||        schmidt hold major-**league** record for most home run 548 rbi 1,595 and extra-base hit 1,015 by a third baseman",1
staff_nn,of level between the top of the level frame and the place where the **staff** be hold up        ||        well say lucy if you will cut us some long **staff**        ||        in order to secure it the more effectually in the ball there be a hole which receive the one end of the **staff** of the umbrella which be secure in it either by a        ||        so back to the river he hurry where the neckan sit weep sore and lift his **staff** of blossom he cry to him weep no more        ||        she feel more confidence in him then than she have ever feel before and she realize that he would be the stay and the **staff** of her declining year,the **staff** be cut from 11 to 4        ||        **staff** we have enough outlet in south america -- al-sabah manage to get all the big brand        ||        visitor management -- training tool and **staff** be a promising area for private assistance        ||        ask who **staff** the clinic -- an ibclc be preferable        ||        **staff** writer ellen sweet can be reach at 303-820-1284 or esweets@denverpost.com,1
score_nn,very likely on the **score** of the negro        ||        better settle old **score** ' fore you talk o ' runnin ' up new one        ||        the mean time the six month man come tumble in by **score** to supply their place        ||        it indeed object to such conduct on the **score** of principle        ||        i believe a **score** of ball strike my person yet they seem to fall from my cloak harmlessly like hailstone,league **score** average average point **score** for select year 1984-85 - 110.8 1989-90 - 107.0 1994-95 - 101.4 1999-00 - 97.5 2000-01 - 93.8 high scoring team number of team that average more than 100 point for select year 1984-85 - 23 of 23 1989-90 - 26 of 27 1994-95 - 16 of 27 1999-00        ||        nutrition **score** per serve 1 cup 221 calory 24% fat 5.8 g 0.8 g saturated 70% carb 41.5 g 6% protein 3.4 g 3.9 g fiber        ||        outlook steelers have be dominant at home win 26-3 37-16 21-0 and 38-7 and against cleveland 8-0 by an average **score** of 29-12 but resurgent brown make this a tough call        ||        nazareth 26 chicago christian 0 joe mankiewicz 22 carry 132 yard **score** on run of 12 11 and 1 for nazareth 7-1 5-1 private school league        ||        // la salle win a ball game -- 89-68 against hofstra -- but lose a ball player ken durrett a 6 ' 7 sophomore with a **score** touch,1
player_nn,when thus release neither he nor the **player** who have        ||        when **player** by their conduct remove the bar then let the intercourse commence        ||        what depth of expreasion in the eye which seem ever to be rest with tenderness upon the face of the **player**        ||        lie lead with every nerve and muscle and he seem to throw himself into every one of his **player**        ||        he be not an intellectual **player** he be rough he be coarse but withall he be great he be human,"in 49ers history key **player** in switch to 3-4 front 57 colby bockwoldt ilb 6-2 245 26 4 fa-07 byu former saint titan excel on special team 54 roderick green olb 6-2 274 25 4 fa-06 c.-a missouri <nul>        ||        // la salle win a ball game -- 89-68 against hofstra -- but lose a ball **player** ken durrett a 6 ' 7 sophomore with a score touch        ||        a 20-inch flatscreen tv a dvd-**player** and stereo        ||        a most popular man aaron over the last two season have accumulate more all-star vote than any other **player** -- 2,514,163        ||        **player** will not be able to reach this fairway into a 15-to 20-mile-an-hour wind say micheel",0
area_nn,"ohio he say comprise an **area** of 4,000 square mile and contain a population of 72,000 soul        ||        the pressure upon the side of any vessel be the half of the pressure that would take place upon the bottom if of the same **area**        ||        it have a level summit of several acre **area**        ||        thus the **area** upon the summit be surround by six tumuli of various elevation        ||        it be 138 mile in length and 50 mile in breadth the **area** be about 6600 square mile","major earthquake occur in the **area** in 1862 1950 1957 and 1959 and there be small shock in 1960 and 1961        ||        side street/parking **area** -- goa/beachtown -- day a16 * kirill now park and out of the car -- on the move -- on * foot -- he begin a sweep of the beach        ||        its octagon measure 143 foot 44 m in diameter and it cover a total **area** of 82,000 square foot 7626 m2        ||        not -- and that be not in the six corner **area** alone        ||        palapa - water **area** - day ramirez blain and billy race down the back stair of the palapa fire",0
group_nn,but the **group** should be very instructive to our people        ||        the execution of the single **group** be eminently successful there be perhaps defect but only in the complete transition        ||        there be more of domestic life even in the steerage of a packet-ship where like seek its like and little congenial **group** be form before the voyage be over        ||        drive from the me quincmpoix they form **group** in the place yendome        ||        upon the hillside small **group** of bullock be see some quietly browse other slowly wind into the valley,"hall technique **group** 240 to 328 wpm for a 37% gain placebo **group** 250 to 278 wpm for a 11% gain control **group** 268 to 290 wpm for an 8% gain        ||        a nightclub owner offer him a gig for a small **group** -- with a bassist guitarist and drummer --        ||        be form -- a **group** know to federal agent as the        ||        be hereby license to drive motor vehicle of **group** 1a ib 2 3 12 and 13 only from to dec 1960 until 9 dec 1963 inclusive        ||        so far it have sell 2,000 copy and have earn the **group** $300,000 in royalty",0
coach_nn,i should have scrutinize the queer **coach** and the queer people closer have not my horse my good old        ||        so they all go to the **coach** and the gentleman attempt to open the door lead to the coupe        ||        so long as they confine themselves to frightening obnoxious member of the nobility out of their **coach** or        ||        he see the **coach** roll on they be safe and he dismiss the matter        ||        the wheel of his **coach** will not be hear on the fine gravel of the lawn,smith 's year-by-year record as head **coach** season w-l pct 1961-62 8-9 .471 1962-63 15-6 .714 1963-64 12-12 .500 1964-65 15-9 .625 1965-66 16-11 .593 1966-67(1) 26-6 .813 1967-68(1) 28-4 .875 1968-69(1) 27-5 .844 1969-70 18-9 .667 1970-71 26-6 .813 1971-72(1) 26-5 .839 1972-73 25-8 .758 1973-74 22-6 .786 1974-75 23-8 .742 1975-76 25-4 .862 1976-77(1) 28-5 .848 1977-78 23-8 .742 1978-79 23-6 .793 1979-80 21-8 .724 1980-81(1) 29-8 .784 1981-82(2) 32-2 .941 1982-83 28-8 .778 1983-84 28-3        ||        **coach** geno auriemma 393-95 15 year        ||        yes -- 1 .... yesmorrow .... no .... no -- **coach** .... nomundy'smill ... na .... na .... namt        ||        cal 2004-05 11-18 4-14/8th **coach** joanne boyle 1st season pre-conference 8-2 notable result loss to <nul>        ||        's and father 's irritation -- and to **coach** bob 's amusement,1
firm_nn,the preacher clasp in the **firm** embrace of peter could not realize the scene        ||        nevertheless a new **firm** will offer inducement not to be despise        ||        the young man be therefore send to lyons where he remain for some time in the countinghouse of an eminent genevese **firm**        ||        there be oculist john williams great eye-curer insert eye where none have be before make the blind to see **firm** sure and those that much do see to see the more        ||        keep your counsel trust none that ye know not keep your lip shut and your heart **firm** and meet me where i tell,"professional federal bureau of investigation 1957-1959 shoob &; mclain law **firm** atlanta 1960-1966 nunn geiger &; hunt law **firm** houston county <nul>        ||        in addition just two week ago a moonie-run **firm** pay $650,000 to buy a marina and bob 's clam shack a bankrupt restaurant        ||        american who work in the usa and live in canada for fewer than 183 day a year typically do not incur canadian tax according to carey singer tax partner at mintz &; partner a toronto-based account **firm**        ||        institution like calpers -- pension fund insurance company money-management **firm** -- own about 58% of itt stock and a majority of the share in dozens of other major u.s.- corporation        ||        nevertheless tax analyst and advocate a public-interest tax-law **firm** base in washington have challenge the write-off on a variety of ground",0
challenge_nn,at every corner we be **challenge** by a sentry        ||        remember i do not **challenge** you i do not come here tomorrow to fight you        ||        how dare you **challenge** me or question my deed when your own crime glare in the eye of heaven        ||        time waft on the terrible revenge the doom **challenge** by century of guilt        ||        21 in the hat and no 22 in the shoe they would sometimes deliberately swear when **challenge** as to age that they be over 21 or between 21 and 22,have be surprise -- and pleased -- to find they be up to the **challenge**        ||        for **challenge** outdoor package at good price try kaibab mountain/desert bike tour 800-451-1133        ||        with dad the out-of-context **challenge** be standard fare meat and potato        ||        april 3 the great **challenge** cbs 2-3 pm        ||        scott 's picks * gac no real **challenge** until <nul> 29 buford matchup brookwood 0-2 at valdosta 1-1 8 pm,0
campaign_nn,203 visit to detroit 203 reach fort armstrong 206 refuse to submit to keokuk 209 his final speech in the council 215 visit in 1837 to washington 216 visit to boston 217 to cincinnati 217 his character and personal appearance 218 number of his warrior in **campaign** of 1832 220        ||        little or no effort be therefore make by the ally in the interval between the two **campaign** to reconcile the belligerent party        ||        no ' i tell her we have n't be to college together but we have be on a northern **campaign** together against the yankee ' but for the life of her she could n't keep her eye off me        ||        he consent with some reluctance for the business of the **campaign** be only begin to open itself before        ||        return to quiet life -- french and english prepare for hostility -- plan of a **campaign** -- general braddock -- his character -- sir john st,"one party -- the democrat -- regularly say all the right thing about **campaign**        ||        king turn a can-do **campaign** into a can ' t-do administration rich say repeatedly        ||        out of a total u.s.- force that grow to more than 300,000 troop 15,000 die in the **campaign** and 48,000 be wound        ||        -- britain wind up a slick americanized election **campaign**        ||        national chairman now co-manager of the nixon-lodge **campaign**",0
game_nn,the owner of house where **game** table be keep be liable for        ||        there be plenty of **game** my dear fellow there be indeed        ||        why we will e'en keep on till we run down our **game**        ||        this be the most interesting moment of the **game**        ||        go my friend seek more worthy **game**,**26;54375; 668 **76;54403; lnterface flooring a **26;54481; 117 020 **26;54509; 5 764 **76;54537; intergraph cp **26;54615; a1 044 605 **26;54643; r636 571 **76;54671; interleukin 2 wts **26;54749; a43 498 **26;54777; 25 672 **76;54805; intl clinical lab **26;54883; a138 221 **26;54911; 120 923 **76;54939; intl **game** tech **26;55017; 72 820 **26;55045; 54 081 **76;55073; investitech ltd **26;55151; n111 184 **26;55179; 0 **76;55207; investitech ltd uts **26;55285; n50 794 **26;55313; 0 **76;55341; irvine sensor cp **26;55419; a41 484 **26;55447; 20 003 **76;55475; xx_j b restaurant inc **26;55553; 45 876 **26;55581; 28 769 **76;55609; jacobson store inc **26;55687; a59 215 **26;55715; s26 748 **76;55743; jerrico inc **26;55821; a88 998 **26;55849; 73 745 **76;55877; jiffy lube        ||        a ccha **game** at the pavilion complete a weekend sweep by the flame 16-17-1 11-16-1 of the redskin 11-22-1 6-21-1        ||        he hit .295 in 36 **game** as a dh and .299 overall in 1976        ||        vander meer be 15-10 in 1938 never win more than 18 **game** in a season and finish his 13-year career 119-121        ||        1976 aegteskabsleg marriage **game** 1977,0
check_nn,will you give me your **check** sir        ||        but our cheerfulness receive a sudden **check** as we come up to them        ||        there be time when the pulse of a susceptible heart can not be **check** by        ||        these as be well-known be female whose normal development have be **check**        ||        for a few week he pursue his course without a **check**,1-877-807-3805 petzl.com or **check** out the petzl micro headlamp economy-priced at $24.95        ||        klaus reisinger -- black star for usn &wr) map ethiopia david s.-a merrill -- usn &wr) photo **check**        ||        it call ' to mind that here and abroad -- first in italy and then in germany -- a major question about right-wing activity have always be who pick up the **check**        ||        just have to double-**check** that be all        ||        if so send it to reality **check** parenting 530 fifth avenue new york ny 10036 or e-mail it to * * 27 1041 toolong,0
problem_nn,the stiffness of timber be therefore a more interesting **problem** to the carpenter than the strength        ||        and one may well despair of bring any help to those who be puzzle themselves over the **problem**        ||        how may we settle this **problem** but by enquiry        ||        case of the postage where no revenue be seek for the **problem** present itself under somewhat modified condition        ||        various unsuccessful attempt be make to solve the **problem**,500 be a 19th-century town with 20th-century **problem**        ||        nor do fly the pattern -- a rectangle around the airport -- present any **problem**        ||        3 1992 report **problem** in achieve the 33/50 initiative 's goal        ||        somebody -- i can n't remember who and it may not matter -- once say that if a **problem** look unsolvable you can always try        ||        p.-a 73 mary jane hanrahan you get ta **problem** with lie,0
type_nn,12mo print in large **type** sheep extra $3 50        ||        it realize then perfectly the fine form of a fine **type** or species ot tree        ||        a **type** of heaven a lively hue of hell        ||        the same work in 4 elegant 12mo volume large **type**        ||        thus we see that it become a **type** of those little nettlesome worry of life that exasperate the spirit,the front-page headline exclaim in seventy -- four-point **type** we be back -- to stay        ||        1955 i want however to avoid a party political **type** of tit-for-tat        ||        **type** links- @55910 <nul> birmingham coach murry bartow 73-52 in four season at uab        ||        you like these dyed-in-the-wool down-home kushy **type** do n't you        ||        's take this ski adapt to all **type**,0
test_nn,we frequently hear of them but when they come to be **test** somehow these worm get where the bee be        ||        not properly understand 142 improper remedy 143 difficulty in decide 144 weak family in most danger 144 their battle 145 bad policy to raise in hive 146 indication of robber 146 a duty 147 a **test** 147 rob usually commence on a warm day 148 remedy 149 common opinion 149 a case in point        ||        ile thus put the reality of his mission to the **test**        ||        you can not **test** for yourself the object before you        ||        i make his obedience the **test** of his love,"at a glance pursuit 2570 price w/**test** power $82,515 loa 24 ' 9 beam 8 ' 6 draft 1 ' 6 <nul>        ||        * thermal performance of a supply-air window **test** -- <nul> barakat solar today 2(1):10-11 january/february 1988        ||        we have now conduct the high-dose rat **test** -- the        ||        and i think i have pass that **test**        ||        run the 3200-meter relay as a warm-up **test** my tendon",0
sport_nn,the chief however be for noble **sport**        ||        page 149 line 21 from top for spirit read **sport**        ||        the spot select for the **sport** be a retire field where there be little danger of be interrupt        ||        t be better than to live on the very **sport** of hope        ||        sith say the other we never see such **sport** at the brocken,its a wet job sail on a 12-meter boat -- but that be part of the **sport**        ||        but at 20 suffer -- ing ulcer and other symp -- toms of a badly mistreat -- ed body he be give a shove -- which also come from his father -- right back into the **sport**        ||        unbeaten -- a good word in most **sport** -- never really apply in race        ||        saturday august 31 abc 's wide world of **sport** abc 5-6:30 pm        ||        abc 's wide world of **sport** abc 5-6:30 pm,0
file_nn,when the procession reach the **file** extend from the throne the soldiery compose them present arm and the musician step on one side the governor precede by        ||        the end of the screw be then **file** off so that this portion of        ||        meseems it redounds but little to the credit of a **file** of twenty man        ||        of what consequence be it to you whether you take your place at one end or the other of the **file** in which they be draw up to recite        ||        hold up your sabre my man that they do not strike your spur or stirrup and follow me in single **file**,"* cronin * -- kurt be reopen all the wyfi and sit * link -- * pamela * -- uplink all relevant **file** to * kim -- * a look back at zorn * -- and i want them to contact anyone who * have anything to do with treadstone -- * zorn look to abbott as they disappear around a * corner .... * b131 ext        ||        the whitman **file** -- born <nul> 26 1946 in oldwick n.j. -- family married john whitman a financial consultant        ||        of the 214,361 consumer report subscriber who respond to our 1997 annual questionnaire 24,841 **file** for loss average $1,500        ||        number tell the story from 1965 to 1975 some 15,000 report be **file** by u.s.- company        ||        in an age of belated racial redress white america -- the rank and **file** the lower-middle class -- feel itself under siege",1
today_nn,she have nowhere else to go **today** but resolve tomorrow to seek a shelter elsewhere        ||        ai n't you go to school **today**        ||        she have keep her bed ever since and a fever be likely to ensue which have only leave her out of danger **today**        ||        do n't you mean to get up **today**        ||        cry out chee chee chee up chip ' chip ' chipperway ouble wee glad you be go you will get good **today** do n't stop the bell be toll,"1-800-247-1550 70% new +2.6% founder equity-income 1-800-525-2440 46% 3.1% <nul> gabelli growth 1-800-422-3554 36% 14.9% <nul> gintel fund 1-800-243-5808 56% 4.6% <nul> iai regional 612-371-2884 35% 6.6%% <nul> janus fund 1-800-525-3713 61% 10.0% <nul> mathers fund 1-800-962-3863 93% 9.4% +7.9% mutual beacon 1-800-448-3863 35% 4.9% <nul> oppenheimer blue chip 1-800-525-7048 35% 2.2% <nul> strong discovery 1-800-368-3863 64% new <nul> vista growth discovery income 1-800-622-4273 63% new <nul> average diversify stock fund 0.7% <nul> s 4.9% 500 stock index 1.9% <nul> 1 - all dividend and capital gain reinvest source usa **today** research mutual fund value        ||        ## txt time-11 <nul> <nul> to 11 p.-a <nul> **today**        ||        2002 by bob riha <nul> usa **today** 13        ||        * where troon scotland * when **today** through sunday * course royal troon golf club * winner 's purse 422,500 * tv espn -- **today** and tomorrow 6 a.m.-that to 11 a.m.-that and 4:30 to 7:30 p.m. abc -- saturday 7 a.m.-that --11 a.m.-that sunday 6:30 a.m.-that am        ||        dr.-i fukhito and i talk about mama and daddy **today**",0
club_nn,mohi tell how they come to **club**        ||        hence indeed the name of the **club**        ||        he become at the same time a member of the belle lettres **club** whose principal object be improvement in literature        ||        i be very sorry you persuade me to join your **club**        ||        george woodhull i will try you with a **club**,"* where troon scotland * when today through sunday * course royal troon golf **club** * winner 's purse 422,500 * tv espn -- today and tomorrow 6 a.m.-that to 11 a.m.-that and 4:30 to 7:30 p.m. abc -- saturday 7 a.m.-that --11 a.m.-that sunday 6:30 a.m.-that am        ||        cheyenne sunrise lion **club** 307/778-8568 dorr71 <nul>        ||        in various home 281-331-2060 brazosport garden **club** 7 p.m. the first tuesday of the month at lake jackson library 979-233-2932 freeport founder garden **club** 9:30 a.m.-that the second thursday of the month at freeport library 979-233-4945 lake jackson garden **club** 9:30 a.m.-that the second wednesday of the month at lake jackson library 979-297-1311 pearland garden **club** 7 p.m. the fourth tuesday of the month 2425 south grand <nul>        ||        the waspiest imaginable man 's **club** -- day 23 all dark wood and oriental rug        ||        when he reach the **club** he wheel the vehicle",1
base_nn,but even here there be very little upon which to **base** a conjecture        ||        you will not yield to his **base** proposal        ||        presently a light step be hear in the thicket at the **base** of the ledge        ||        to brazzo out of my door **base** slave        ||        the sac which he suppose secrete a fluid for stick the egg to the **base** of the cell be the seminal reservoir or <nul>,"he have 381 and 358 total **base** in ' 02 and ' 03        ||        ford 's eight-seater crew wagon -- so call because it can haul a construction crew -- be **base** on its f-350 model truck        ||        schmidt hold major-league record for most home run 548 rbi 1,595 and extra-**base** hit 1,015 by a third **base**man        ||        his radio crackle -- louise 's voice chief **base**        ||        the **base**-level of the water-table in the chalk <nul>",0
