word,corpus1_sentences,corpus2_sentences,annotation
style_nn,there be numerous college which be build in the **style**        ||        the whole tone of the **style** of the book smack of lowness        ||        from the general contempt they entertain for those who be **style** the rebel        ||        its **style** be in the main excellent        ||        the **style** of these letter be in general very good sometimes poetical and eloquent,"georgetown iii 2-bedroom town-house-**style** condominium 130,400 to 154,400 on mckee street 1/2-mile east of randall road batavia j.-a p.-a o'connor and <nul> 708 879-9292        ||        build a gothic-**style** cathedral out of hand-worked masonry take a while -- a few decade here a few decade there -- and mr.- bambridge look and act like a patient man        ||        new-age retro that be what i have call it -- a ' ' 50s innocence reinvent ' ' 90s-**style**        ||        suite - plaza hotel - day francoise be wear panty bikini **style** and a t-shirt that say hand across france        ||        2 asian-**style** baby back rib on green papaya <nul>",0
cost_nn,"the whole quantity of public land sell be 44,500,000 acre quantity grant for various purpose 16,040,624 acre unsold within the limit of the state and territory at the end of 1835 220,000,000 acre beyond those limit 750,000,000 whole quantity survey 122,300,000 total **cost** of the land 58,438,824 dollar total receipt thus far 64,029,496 dollar        ||        the **cost** of make it be estimate at $1,000,000        ||        how much do your tobacco **cost** you johnson        ||        where three hive be make in one structure the glass for the three will **cost** less than 50 cent if double glass be not use the expense would be less by one half        ||        the estimate of the maximum **cost** of this work be $500,000","on july 23 at 9 a.m.-that breakfast will be at the same location **cost** -- $9        ||        average **cost** $50,000* rate capacity 10 kw output 1,600 kwh/month * * warranty stat 5 year        ||        she have **cost** him - **cost** them all - too much        ||        if you be truly **cost**-conscious -- and do not require the hand-holding that        ||        the fact that a router be call crs-1 -- and can **cost** about a million dollar -- do n't faze the specialized technician who purchase them",0
tradition_nn,-- mohegan **tradition** -- historical society -- programme of a tour in the east -- parental disobedience -- indian treaty -- dr.-i warren 's collection of crania -- hebrew language -- geology -- good offer -- mrs.- jameson -- mastodon 's tooth in michigan -- captain marryatt -- the icelandic        ||        the tree upon which he sit be one of those magic tree which the **tradition** of his people entitle the arm-chair of tustenuggee        ||        some of these fact it be true rest on **tradition** yet we be willing to believe them as they impart a gleam of just and generous feel to his closing scene        ||        there be more pleasing **tradition** of the beautiful wife he bring home to grace the luxurious dwell he have fit up in a style of almost princely splendor compare with the plain abode of even the best off people in town        ||        but these **tradition** be more valuable than coin in one respect they have a value even if they fail to he interpret,home **tradition** <nul> lexington ky 859 543-8845        ||        202 357-4500 offer a colorful exploration of african-american quilt **tradition**        ||        at dawn we load the canoe two trim 18-foot wood and canvas beauty that smack of **tradition**        ||        the arbitrator say that a nine-year-old **tradition** could not be summarily abolish        ||        the set of the fine food service -- the **tradition** -- steep formal establishment with headwaiter captain and extensive menu selection -- finally fall like a gustatory bastille,0
artist_nn,the **artist** must catch this high truth must put        ||        these be the **artist** the orator the leader of society        ||        we prefer of our **artist** 's present effort the picture of ' his wife '        ||        the **artist** look at the ticket a little enviously        ||        other **artist** give themselves up wholly to the study of their art,god -- the **artist** 's credo be that simple        ||        a c.-a 1880 painting by new england marine **artist** william p.-a stubbs 1842-1909 dominate the living room 's grouping of ship painting and shadow box        ||        ohio art council individual **artist** fellowship 1984 ' ' 86 ' '        ||        gab you just do n't understand about **artist** **artist**        ||        <nul> 20 -- easy rider pizza cutter with suspension 2001 aluminum bronze stainless steel acrylic ball bearing enamel paint 3 3/4x 8 1/4x1 1/4 inch in craft form 2002 including 76 **artist**,0
skin_nn,it fit like turn him round **skin**        ||        the two superfluous leg of the sheep be only two shrivelled piece of **skin** cut out like thong        ||        such languish eye such ruby lip such polished **skin** cur        ||        when her **skin** be remove some small piece of lead be discover beneath it        ||        the wind cool them in summer in winter **skin** keep them warm,he be a big man -- around six-three and more than two hundred pound -- with a strong jaw a line face and sunburned **skin**        ||        g be tall and have dark **skin** and hair that be real black and wavy        ||        carolina balamaci an aesthetician at anastasia beverly hill in california share jada 's secret to keep her slightly oily **skin** in balance jada visit the anastasia salon for a facial at least once a month        ||        and wear a **skin** hat and carry a club or a sword as a professional prop        ||        but the remarkable legacy hispanics carry from latin america be not language -- an inflatable **skin** -- but breath itself capacity of soul an inclination to live,0
fabric_nn,a little make with low top with red clock to show they be your **fabric** one of the sweet knitter in the market        ||        te w we unvm com * t * * * ti * r o ' * e 0 twirc xx_n a year * xiti ib * * s oiic & the * 7ucbwi * * v * flio aod wlie * * <temp> t* il c * s * y nien ' in rem dv * herc be lxi jie 1 * * inl le * * be * e a * b * vb 1 vcnerablc // **fabric** tremble merely for the purpose of remove        ||        they have see republican institution mix up with other of a different nature but they have never see them use for the entire **fabric** of a        ||        it be much to be regret that such imperfect monument remain of this curious political **fabric**        ||        the whole **fabric** be so well construct that the wild bull sometimes make use of them for the purpose of observatory and find them strong enough to bear their weight,inflatable module -- light and easy to transport -- could be couple with a **fabric** that harden in the area 's abundant uv light        ||        add black as an accent color in **fabric** and accessory        ||        nita angeletti anne boleyn 1992 paper papier-mache paint lace vintage **fabric** 18 by 10 by 8 inch        ||        feathered friend hyperion down jacket $175 featheredfriends.com 206-292-6292 pick your color and **fabric**        ||        no attempt to change the whole context -- tear as it be a hole in the **fabric** of factuality,0
construction_nn,how without model do they execute those wonderful **construction** of which some species only know the secret        ||        elsewhere these contest frequently grow out of question about the **construction** of charter        ||        the **construction** must be such as not to divest the state of those numerous undefined power which they reserve to themselves when they enter into the compact        ||        be these duty to be impose and the right and power necessary to their execution confer upon the general government by mere **construction**        ||        upon which statute you present the following question of **construction** 1st,"ford 's eight-seater crew wagon -- so call because it can haul a **construction** crew -- be base on its f-350 model truck        ||        20814 301-951-6122 www.american-capital.com found 1986 revenue $206.28 million net income $117.98 million earnings per share $2.15 dividend $2.79 stockholder equity $1.18 billion auditor ernst &; young llp stock acas nasdaq asset $2.04 billion market capitalization $2.06 billion 52-week high $34.91 2/18/2004 52-week low $20.75 8/15/2003 chairman and ceo malon wilkus coo ira wagner employee 132 local employee 50 description american capital strategy invest in and lend money to medium-size company in transportation **construction** health care and retailing        ||        the epa have estimate the investment necessary for wastewater system at roughly $140,000,000,000 over the next 20 year including $44,000,000,000 for wastewater treatment $10,000,000,000 for upgrade existing wastewater collection system $22,000,000,000 for new sewer **construction** and $45,000,000,000 for control sewer overflow        ||        car boat **construction** material hazardous waste and plastic        ||        the city have approve the **construction** of a 55,000-seat stadium for",0
minute_nn,no not at that **minute**        ||        let them simmer two or three **minute** stir them all the time        ||        pinchbeck before many **minute** elapse i expect her here        ||        when he go upon the bench he keep **minute** of his decision        ||        it be not five **minute** however ere these fellow be gratify,"... rating .... share .... network 1 .... 22.7 .... 60 **minute** .... 37 .... cbs 2 .... 19.1 ....        ||        that 7,353-mile stretch take 124 day 22 hour 53 **minute**        ||        photo color concord **minute** man of 1775 by daniel chester french 1889 remodel from 1875/cast 1917 bronze 32 1/4 x 17 1/8 x 18 3/8        ||        could it be -- now wait a **minute**        ||        for about 15 **minute** -- literally -- he be big than young tiger",0
millions_nn,"in 1800 theysold 4,054 value at 3,142,591 1810 4,561 8,070,955 1820 4,006 8,255,603 1830 8,778 11,255,767 1835 12,977 13,215,464 1837 16,916 25,395,300 take the sicca rupee at forty-five cent of our currency which be its low value the opium sell in 1837 would amount to nearly twelve **millions** of dollar        ||        the interest on the debt be eighty **millions** or one half the revenue of the government        ||        in many place in new jersey where there be now scarcely a bee to be see there once exist **millions** of these insect to the great profit of their owner        ||        421 // land in lousiana be originally five **millions**        ||        not for **millions** of dollar would i part with you","-- - table first 9 week of fiscal year a- ' 87 sales ' 86 sales b-% **millions** **millions** change sear        ||        in china and // india famine in 1555 and 1596 kill **millions** and empty entire region        ||        this be the scandal with everything -- penis power intense emotional pain -- and **millions** tune in        ||        black as % of all firm in state 4.4 black sales receipt in **millions** 2,268        ||        this be an ahistorical position that serve as a justification of a status quo that leave **millions** without basic necessity",0
camp_nn,love rule the court the **camp** the <nul>        ||        back to thy **camp** thy troop thy country altorf        ||        we determine therefore to send a flag to the **camp** on some pretext        ||        spectator of the scene now direct their people to return to their **camp**        ||        the enemy 's **camp** be the place for a spy,**camp** date include <nul> 21-22 <nul> 20-21 <nul> 18-19 and <nul> 27-28        ||        contact **camp** trail 800 572-8822 www.**camp**trails.com        ||        and i have start at 11:15 a.m.-that from the alley **camp**        ||        month ago -- before he even be aware of what be happen -- mr.- scheelhaase be subtly court by the dukakis **camp**        ||        follow his discharge from an american prisoner-of-war **camp** in 1945,1
university_nn,"360,000 breslan **university** library 250,000 oxford bodleian library 220,000 tubingen **university** <nul>        ||        an equal severity have never be apply to **university**        ||        dodge 's treaty -- additional debt claim -- gazetteer of michigan -- stone 's life of brant -- **university** of michigan -- christian keepsake -- indian etymology -- small-pox break out on the missouri -- missionary operation in the north-west -- treaty of flint river with the saginaws        ||        the preference at either **university** become vacant the eldest member of the class be promote his place be fill from the most promising of the deputy grecian        ||        xii 2 term use in the buttery book at the **university** see minsheu in <nul> <nul> size and cue",- dana falkenberg 3 **university** park md        ||        -- **university** of illinois basketball recruit marcus liberty of king be 0- for-2 on the act        ||        church be born may 11 1930 and school at cambridge **university**        ||        appalachia **university** press of kentucky 235 page $25        ||        in march 1967 two of the **university** trustee -- william zeckenthirf sr. and xx_j r.-he,0
amendment_nn,the **amendment** be to be submit to the people        ||        your subsequent **amendment** only go to these three **amendment**        ||        the **amendment** be in these word the power not delegate to the united state by the constitution nor prohibit by it to the state be reserve to the state respectively or to the people        ||        if the propose **amendment** be agree to by a majority of the member of both house where shall the propose **amendment** be enter        ||        again in the tenth **amendment** it be declare that the power not delegate by the constitution nor prohibit by it to the state be reserve to the state respectively or to the people,"1582 propose an **amendment** to section 181(a) of the 1990        ||        the senate 's caa **amendment** s.-a 1630 allow incinerator ash to be treat as non-hazardous <nul>        ||        they vote 361 to 65 in favor of an **amendment** that reduce the endowment 's 1990 budget by $45,000        ||        the mcgovern-hatfield **amendment** be one of the early get-out-of-vietnam proposition        ||        two such **amendment** be defeat in the house by vote of 75 to 49 and 70 to 52",0
secretary_nn,"his whole soul seem somewhere else just at present exclaim the **secretary** bitterly        ||        here the general be welcome by the priest in return for which he deliver them the speech prepare for him by his **secretary**        ||        according to the report of the **secretary** of the treasury * the amount of bank paper in circulation on the 1st of january 1838 be 116,000,000 of the deposit 84,000,000 of the species in their vault 35,000,000 and the note issue by one bank but in possession of another near 25,000,000        ||        the president will say there be a quorum of member present the **secretary** will read the minute of the last meeting        ||        it should excite no surprise when we find the executive through his **secretary**",assistant **secretary** for system analysis vacant for a year        ||        ap - former alabama coach wimp sanderson have a 15-year extramarital affair with the **secretary** he be accuse of punch in the face the woman say in a swear statement        ||        the third-most-talked-about option energy **secretary** bill richardson 52 have his fate tie in part to gas price        ||        first the wording of the constitution make it clear -- uh -- clear that the successor must be an officer ' and the weight of legal opinion be that dilman as a senator and the speaker before him and the -- uh -- the **secretary** of state after him be not technically officer at all        ||        scene 39 - ms picabia szanto miss malikoff and the **secretary**,0
security_nn,theft be unknown though lock be never use for **security**        ||        it be not my sense of **security** then        ||        some of these writer seem to seek a **security** from the penalty of notoriety in the lowliness of their pretension        ||        a just jealousy of ruler be the best **security** of the rule        ||        i be too apt to think my **security** depend entirely on your presence,"moscow enclose market -- day 306 a **security** guard -- hear the commotion -- jog out and delete 307 308 ext        ||        turn on long-term highest-quality **security** be almost -- double the city 's        ||        and no wonder the potential reward -- in industrial productivity scientific research and national **security** -- be stagger        ||        expansion st f social **security** benefit <nul> $750 - 000,000 to the annual cost        ||        hospital room - day a mini-cam crew interview the old **security** guard",0
founder_nn,in one respect indeed new england lose much by the sturdy independence of her **founder**        ||        the grand **founder** of the present etherial system of the empire ame entitle to hereditary honor        ||        or can we point to any romulus and remus for our **founder**        ||        certainly there be little reason for sharply censure the **founder** of a small colony here in new england because they be        ||        the rock amid the ruin allude to peter the reputed **founder** of the bishopric of rome his greek name mean a rock,1-800-247-1550 70% new +2.6% **founder** equity-income 1-800-525-2440 46% 3.1% <nul> gabelli growth 1-800-422-3554 36% 14.9% <nul> gintel fund 1-800-243-5808 56% 4.6% <nul> iai regional 612-371-2884 35% 6.6%% <nul> janus fund 1-800-525-3713 61% 10.0% <nul> mathers fund 1-800-962-3863 93% 9.4% +7.9% mutual beacon 1-800-448-3863 35% 4.9% <nul> oppenheimer blue chip 1-800-525-7048 35% 2.2% <nul> strong discovery 1-800-368-3863 64% new <nul> vista growth discovery income 1-800-622-4273 63% new <nul> average diversify stock fund 0.7% <nul> s 4.9% 500 stock index 1.9% <nul> 1 - all dividend and capital gain reinvest source usa today research mutual fund value        ||        in various home 281-331-2060 brazosport garden club 7 p.m. the first tuesday of the month at lake jackson library 979-233-2932 freeport **founder** garden club 9:30 a.m.-that the second thursday of the month at freeport library 979-233-4945 lake jackson garden club 9:30 a.m.-that the second wednesday of the month at lake jackson library 979-297-1311 pearland garden club 7 p.m. the fourth tuesday of the month 2425 south grand <nul>        ||        ## **founder** briton hadden 1898-1929 henry r.-he luce 1898-1967 editor- in- chief jason mcmanus chairman and chief executive officer j.-a richard munro president and chief operate officer <nul> j.-a nicholas jr        ||        ## **founder** briton hadden 1898-1929 henry r.-he luce 1898-1967 editor- in- chief jason mcmanus chairman and chief executive officer j.-a richard munro president and chief operate officer <nul> j.-a nicholas jr        ||        23 **founder** briton hadden 1898-1929 henry r.-he luce 1898-1967 editor- in- chief henry anatole grunwald chairman and chief executive officer j.-a richard munro president and chief operate officer <nul> j.-a nicholas jr,0
kitchen_nn,he speedily dress himself and open the **kitchen** door we seat ourselves before the fire        ||        sometimes walter go down to peep into the **kitchen**        ||        ere long her prayer be answer for there come to the house where she live a gentleman and lady who see the little **kitchen** girl        ||        the saddle be this minute lie on the dresser in the **kitchen**        ||        turn through the **kitchen** when he have no more right to the money than he have to me,"price $70 to $120 per square foot install $1,950 to $4,400 for an average-sized **kitchen**        ||        total fat 45g 69% saturated fat 19g 94% cholesterol 127mg 42% sodium 1460mg 61% carbohydrate 31g 10% dietary fiber 1g 4% sugar 3g protein 36g vitamin a 16% vitamin c 2% calcium 43% iron 16% roast chicken with lemon make 4 serving 1 6-pound roast chicken 2 lemon **kitchen** twine or thread 2 tablespoon olive oil kosher salt to taste 1        ||        price $40 to $65 per square foot install $2,200 to $3,600 for an average-sized **kitchen**        ||        in addition the apartment have a **kitchen** and a toilet        ||        121 **kitchen** patti and erica get the food",0
price_nn,in one volume 16mo **price** 75 cent        ||        in one volume 16mo **price** 75 cent        ||        the jubilee be come the **price** be pay return ye ransome one        ||        cloth **price** $1 00 the three mrs        ||        these these i offer you as the **price** of my life,"**price** appetizer 5.75-$ 7.50 entree 13.75-$ 16.95 dessert 4.25        ||        its peugeot 505 504 a station wagon and 604 sell in the $11 000-to-$22 000 range with an average sticker **price** of $15 000 to $16 000        ||        from march 1985 to march 1990 the median **price** of home zoom from $125,000 to $235,000        ||        415 773-6168 rating three and a half star **price** $$$$ noise 1 bell        ||        **price** on weekday dip to $39 adult $34 age 6-17 half-day or night session cost $28 adult $23 age 6-17",0
breast_nn,my revenge be not yet complete she fiercely cry level the pistol at his **breast**        ||        tell me ye who ride the wave ye who **breast** the thunder storm issue from the northern cave see ye winter be icy form        ||        nay then weep on my **breast** silly one if you will        ||        little kate make her journey often to papa but the other keep her care in her **breast**        ||        one wish alone inspir have my **breast** it be to see my ednee blest,and the survival rate for patient with advanced **breast** cancer -- an average of two year -- have n't change appreciably        ||        you might say i be a **breast** cancer activist        ||        i think my doctor make my **breast** big than they should have be for my frame -- i be 5 ' ' 6 130        ||        - the dancer lean backwards so that her **breast** be almost in bond 's face        ||        he clasp it to his **breast** with all his love-tentacles and both pair of hand,0
ring_nn,let me see that **ring** if thee please        ||        the nine o'clock bell be **ring** as the young people pass through the quiet street        ||        nor priest nor king prescribe the **ring** the soul must not pass over whom gospel freedom make free to serve the lord jehovah        ||        in 1823 he deliver his speech on greece which **ring** like a clarion        ||        the clear **ring** chime of the college clock finally arouse her to consciousness,only steal thing that begin with an a -a watch a car a suit a **ring**        ||        ## in davenport iowa telephone number 323-1819 **ring**        ||        i often remember dad come to dinner -- a boisterous affair with four son -- and just sit-**ring** at the table not utter a word        ||        we can almost hear - and perhaps we do - a cash register **ring** up        ||        within a few year dictator would carry sinister tone but -- hard as it be to believe now -- the word have a reassu**ring** **ring** that season,0
field_nn,you see those stubble on the hill in those seven or eight **field** there be        ||        be it not him then i meet on the **field**        ||        the spot select for the sport be a retire **field** where there be little danger of be interrupt        ||        to the **field** then to the **field** to the senate or the **field**        ||        long for the **field** where great deed be to be * vie publique et priv * e de joachim,-- craig masback ceo of usa track &; **field**        ||        he be 16-8 in 2002 his rookie of the year season but go 12-13 last year and be 2-5 this year - including an 0-3 record and 6.43 era in four start at coors **field** '        ||        chris bahr kick a 23-yard **field** goal 5:51 into overtime as cincinnati top houston 13-10        ||        i sure wish i could take a vacation in italy -- without a rifle and a **field** pack        ||        a hard-to-handle snap negate a **field**-goal attempt in the fourth quarter and a 27-yard attempt be wide right as regulation end with the score 10-10,0
home_nn,whitman walt 1819-1892 longing for **home**        ||        lloyd -- etiquette among slave -- the comic slave doctor -- pray and flog -- old master lose its terror -- his business -- character of aunt katy -- suffering from hunger -- old master 's **home** -- jargon of the plantation -- guinea slave -- master daniel --        ||        hale sarah josepha buell 1788-1879 no **home**        ||        peirson lydia jane 1802-1862 the happy **home**        ||        yes let us go **home** **home**,"beginning 820 <nul> cleveland <nul> loveland 80537 1-970-667-6241 **home** visitation 2000 303 e. 17th <nul> suite 200 denver 80203 861-1715 lake county school district r-1 315 <nul> sixth <nul> leadville 80461 1-719-486-3946 la plata family center coalition <nul>        ||        **home** tradition <nul> lexington ky 859 543-8845        ||        ikka nakashima 1244 <nul> carmen <nul> 334-1844 class in her **home**        ||        ikka nakashima 1244 <nul> carmen <nul> 334-1844 class in her **home**        ||        from march 1985 to march 1990 the median price of **home** zoom from $125,000 to $235,000",0
