word,corpus1_sentences,corpus2_sentences,annotation
coal_nn,now we be on the subject of **coal** judge temple        ||        his eye large but sunken shine like **coal**        ||        set it on hot **coal** and let it stew five minute stir it all the time        ||        in her leave she hold a small bundle over the hot **coal** in the uncover stove        ||        a week we have to pay for **coal** make up the <nul>,"into the capital 1,870,425 ton or 83.7 per cent be **coal** and 312,653 or 13.9 per cent be food grain        ||        the future jan-feb 2006 p.-a 23 * **coal** could make a cleaner comeback        ||        1973 san juan prospector most cargo 61,078 long ton of **coal** 1973 bulk carrier melodic        ||        tva have a generating capacity of some 12,700 mw both hydro and **coal**-fired in fifty-six plant the large of which be rate at 1,440 mw        ||        contact cheaha state park 256 4885111 * * 27 5440 toolong cheaha1a.html usgs topo cheaha mountain black mountain kentucky elevation 4,145 foot rank 27 summit **coal** truck barrel around the bend of ky 160 a precipitous two-laner and more than a few car roost in the tree far below",0
spot_nn,tell me if there be not some place where ye have be where all be love some **spot** in which there be no sin        ||        well well it do go to the **spot**        ||        the genoese pretend to point out the **spot** where columbus be born        ||        the **spot** select for the sport be a retire field where there be little danger of be interrupt        ||        very **spot** where you now behold me on the sunny pavement,the narrator appear in a **spot** on r.-he c.-a stage        ||        as a 50-year-old with a history of smoking and family heart disease -- not to mention a bit of a paunch -- i be in the sweet **spot** for a cardiovascular event        ||        here at headquarters we now have what we call a hot-**spot** team which operate on a round-the-clock basis        ||        suddenly we four chicagoan **spot** a light in a pub on a tuck -- away corner and race toward it        ||        tick a lock this be a magic **spot**,0
jacket_nn,second dress yeomanry **jacket** sword helmet belt <temp> frederick        ||        their ledger furiously the young gentleman in azure **jacket** flourish their pencil square the circle lunch solve the longitude lunch go the nineteen select youth to the sound of their own flute and french bugle        ||        for a pillow i wrap an old **jacket** round a log        ||        as sure as you do i will dust your **jacket** for you when i come home tonight so that you will not forget it for one while        ||        lewis however do not finally make the visit but permit jim blue **jacket** to make the tour in his place,mr.- vara hand me my trouser and **jacket**        ||        nathan swim with a life **jacket** or a bath suit with built-in float        ||        feathered friend hyperion down **jacket** $175 featheredfriends.com 206-292-6292 pick your color and fabric        ||        as we leave the theater that night he ask me if i have a **jacket** with me        ||        have select a gray suit with matching pant and match-ti **jacket** and no vest the suit he have,0
dust_nn,**dust** to **dust** ' as the parson sez        ||        feel that the spirit of the sleep **dust** there deposit reign with the blest in the realm of eternal peace        ||        to bow thee to the **dust** not end thy life but make thee live feel his weight of vengeance        ||        **dust** thou art say god and unto **dust** shall thou return        ||        **dust** have gather on her brow silently she sleepeth now,at various time in 2000 and 2001 in florida mohammed atta 11 make inquiry regarding start a crop **dust** company        ||        say here on the **dust** jacket itty- bitty insight part 3        ||        as this suggest and as dr.-i liverworth write in the **dust**-jacket copy        ||        the air be secret heavy with **dust** and heat        ||        five mile north of the town 's honky-tonk center -- whose half-paved half-**dust** street be line with ramshackle restaurant and bar -- lie the reason that two million traveler arrive each year the main entrance to the angkor archaeological park,0
hell_nn,he come to set thee on thy throne in **hell**        ||        it seem that there be but a step between me and **hell**        ||        the prisoner in the jail yell like devil in burn **hell**        ||        a type of heaven a lively hue of **hell**        ||        for like lucifer 's soul curst before you no hope now be leave you but **hell**,yeah yeah -- come on who the **hell** else        ||        be basically what i say g.-a like **hell** and shit        ||        where the **hell** be chee when he need him        ||        man #1 irate what the **hell** be that        ||        we be all talk - **hell** i talk all the time - but we be talk to ourselves,0
feed_nn,i will thump him minty i will **feed** me on hay if i do n't        ||        your word your look your beauty **feed** his wrath        ||        for two week i **feed** the little fledgling it be then able to provide for itself        ||        they evei sometimes make a mystery of their manner of **feed** an train them        ||        desert at his utmost need by those his former bounty **feed** on the bare earth expose he lie,i have a wife and a kid and an old man to **feed**        ||        i want to **feed** that goddamn david up '        ||        as he talk al-bukhari occasionally turn away to **feed** his brazier        ||        i it be only the **feed**-back sir        ||        i have to **feed** the baby she say,0
contract_nn,the mind of the bigot be like the pupil of the eye the more you pour light upon it the more it **contract**        ||        jasper may have other purpose in view when our present **contract** expire        ||        of your sign the **contract** to let you live rent free in future        ||        i be here by **contract** to prosecute not to defend        ||        there be such a deeper closer **contract** between the pastor and his flock,"utter silence the **contract** disavowal the title grab-and-hold the air-it-in-public revelation -- tactic of the corporate culture that train many of today 's partner        ||        a **contract** be sign and on november 15 1763 mason and dixon land at philadelphia        ||        that material and **contract** work eventually will total between $15,000 and $18,000        ||        recent crop of art-school graduate must confront the malthusian dilemma of a burgeoning number of artist face a static -- or **contract** -- art market        ||        a five-year **contract** hmm that would the seventy-five thousand",0
information_nn,yes you know very well my opportunity of **information**        ||        we have never see more **information** condense into so small a compass nor ever look        ||        those who wish to know more of him must seek **information** from his own writing        ||        you should be oblige to her for give you the **information** for you know wit be very dangerous people to some folk        ||        most of life seem to be mere advertisement of faculty **information** be give us not to sell ourselves cheap that we be very great,**information** 1-800-661-3830 * * 27 4699 toolong        ||        the reservation and **information** number be 718 339-1542 and 221-1111        ||        for more **information** call 585 359-9310        ||        for **information** or a brochure call 832-593-7777 or visit * * 27 2331 toolong        ||        for an appointment or more **information** call mark taylor at 713-743-9373 or mark cresswell at 713-939-9364,0
want_nn,now we be leave in hopeless friendless **want**        ||        she will know all she will know my necessity my **want**        ||        there be but one avenue through which she could hope to escape from the pressure of absolute **want**        ||        he feel there be an immeasurable distance between them for the first time he find himself **want**        ||        this be not the case with music no imperious physical **want** first call it into existence no model constantly prompt its cultivator to improvement,p.-a 28 lan intense i i **want**        ||        i find out what i **want** i say        ||        troy have win a medal at age 11 and dwight **want** to        ||        p56 it be not at all clear what we **want** to say        ||        and you can have a job if you **want** it,0
intelligence_nn,mere **intelligence** however be not of itself independence        ||        hence the perfect **intelligence** that subsist between wise man of remote age        ||        the reply betray some **intelligence** as well as insolence        ||        have he penetrate unexpected and unlicensed to her chamber and be these the effect produce by the **intelligence**        ||        so great be the difference between form animate by different degree of **intelligence**,"a specialized branch of north vietnamese -- now of course vietnamese -- **intelligence**        ||        an equal degree of **intelligence** be need to design -- or understand -- the great humanist allegory        ||        on the day that the t1771c1 publish its story about the supposed **intelligence** opera -- tion the post publish material from august 1,1983 the carter white house find after the campaign by a collector of memo -- rabilia in a dumpster outside the rea -- gan headquarters        ||        the cia 's satellite eavesdropping washington -- central **intelligence** director r.-he james woolsey want to save his budget -- and he be willing to do a little high-tech show off to accomplish it        ||        in 1967 and 1968 while serve in the army he teach law at the army 's **intelligence** school at fort holabird maryland",1
mission_nn,sigourney <nul> <nul> lydia howard 1791-1865 **mission** to africa        ||        sigourney <nul> <nul> lydia howard 1791-1865 moravian **mission** to greenland        ||        the last the foreign **mission** be excellent        ||        ile thus put the reality of his **mission** to the test        ||        **mission** -- hard time consequent on over-speculation -- question of the rise of the lake -- scientific theory -- trip to washington -- trip to lake superior and the strait of <nul> mary -- john tanner -- indian improvement north of michilimackinack -- great cave -- isle nabiquon -- superstitious idea of the indian connect with female -- scotch royal -- mckenzie -- climate of the united state --,701 **mission** <nul> 415 978-2710        ||        global exchange 2017 **mission** <nul> #303 phone 415 255-7296 e-mail info@globalexchange.org web www.globalexchange.org        ||        be that a **mission** or be that a **mission**        ||        apparently this be not a high-- pressure **mission**        ||        by chance two hour after the bad guy ' phone call have be translate i have wheels-downed in baku with a platoon of seal on a stealth-grade training **mission** q-u-i-e-t-l-y undertake at the behest of the secretary of defense and the chairman of the joint chief of staff,0
jump_nn,**jump** in and go will n't you        ||        can you tell by the **jump** they take        ||        the child **jump** down upon the floor and tottling up        ||        i never see him but i be ready to **jump** into his love arm        ||        if he have not be a goose he might have know he would loose it even if he have be ever so sure of get it for in these politics there s never any tell which way the cat will **jump**,"a condo **jump** from $337,000 to $710,000 since 1999 another 6,000 unit be come        ||        the treasury ' s 7 1/2% bond due 2016 fall to 93 18/32 from 95 19/32 wednesday as the yield **jump** to <nul>        ||        while district enrollment drop from 216,000 to about 200,000 from 1973 to 1978 the number of student ride bus **jump** from 20,000 to over 31,000        ||        mr.- wamala **jump** up as do mr.- lugira behind him        ||        it s instantly translate ' ' **jump** ' ' to its next state",0
structure_nn,where three hive be make in one **structure** the glass for the three will cost less than 50 cent if double glass be not use the expense would be less by one half        ||        there be difference of quality of degree and of **structure**        ||        in the **structure** of his sentence there be a pleasing variety although like most modern he prefer short sentence        ||        as he near upon their view they see more of his **structure** and property        ||        everything astonish me even the **structure** of the small fly,"but other feature -- a for-- ward-thrusting muzzle an orangutan-size brain and an apelike jaw **structure**        ||        the social **structure** of the baganda 194-200        ||        the factor **structure** and loading of the item show high face validity in accordance with the framework propose by bolman and deal 1984,1991 davis and newstrom 1985 dawis and lofquist 1984 and glick 1992        ||        it be a fantastical **structure** all arch buttress and        ||        of the forty-odd exposition **structure** only k.-the melnikov 's makhorka pavilion and the izvestiia-krasnaia niva pavilion <nul>",0
illness_nn,yet in all these **illness** while inure to severe pain she be never subject to depression of spirit        ||        i have however but just commence the work when a serious **illness** confine me to my room for several week        ||        about the middle of the evening the master of the lodge be call home by the sudden **illness** of his wife when the unexpected honor of preside over the lodge devolve on timothy        ||        gertrude in her confusion and desire to shelter seton say he be weak from recent **illness**        ||        i have experience much of the lord 's goodness in every period of my life but i never be more sensible of his mercy than in this fit of **illness**,the prog -- ress of the case be of course de -- lay by rifkind 's **illness**        ||        a daughter anna-lisa johanson of washington d.c.-the say in a statement that ray be destroy by a mental **illness** just as deadly and just as painful as cancer        ||        the next patient with a service-connected **illness** be a thirty-year-old retire draftsman        ||        plath 1932-63 and sexton 1928-74 be friend who spend hour discuss their art **illness** and the way they would kill themselves        ||        of 850 worker -- half which take placebo shot -- show that absenteeism and doctor 's visit due to respiratory **illness** fall by more than 40%,0
shoot_nn,i know not what follow until you **shoot** him        ||        i come within one of **shoot** the pretty girl i ever lay eye on        ||        count julian nay it be vanity to **shoot**        ||        the stem one or more bud be develop which in the succeeding 3'ear become the **shoot** upon which the fruit be produce        ||        six more stroke of the bend oar we **shoot**,235 the highway - day - high **shoot** as bandit i disappear into the alabama mountain        ||        p.-a 25 p.-a 26 act 1 scene 17 trick shot trick **shoot** an actress alone on stage        ||        i can **shoot** an ' i can stand steady        ||        i can **shoot** i say        ||        another road - long **shoot** - day bond 's aston-martin drive up the road from a town in b.g,1
transfer_nn,you write as if you suppose this **transfer** of property would leave you poor        ||        here her friend make use of every expedient they could devise to induce her to **transfer** her affection        ||        no person to be permit to lend or **transfer** any book        ||        the fee charge on every account open and every **transfer**        ||        as i **transfer** to the reader be the emotious of my own breast let him pronounce my sentence,**22;8370; **42;8394; **44;8438; **44;8484; **76;8530; year **26;8608; unified credit **26;8636; tax-free **transfer** **76;8664; 1982 **26;8742; $62 800 **26;8770; $225 000 **76;8798; 1983 **26;8876; $79 300 **26;8904; $275 000 **76;8932; 1984 **26;9010; $96 300 **26;9038; $325 000 **76;9066; 1985 **26;9144; $121 800 **26;9172; $400 000 **76;9200; 1986 **26;9278; $155 800 **26;9306; $500 000 **76;9334; 1987 **26;9412; $192 800        ||        the bearkats have 12 division i-a **transfer** who have join the        ||        mr.- lindsay have 45 day to sign or veto the fund-**transfer** bill        ||        the ram 's stick shift feature a steel-to-steel **transfer**-box shifter similar to ford 's        ||        guard emmanuel holloway average 15.2 point at iowa western usc **transfer** sead odzic be a good shooter and 6-8 brandon sampay add a 255-pound presence inside,0
steam_nn,only a **steam** man say one        ||        godly people must work the wheel themselves unless they prefer to turn it into a treadmill or employ **steam**        ||        superior however as this force be in one point of view to that of **steam** it be very inferior to it in other respect        ||        **steam** require more expensive fixture and the cost of its production be great        ||        her captain wisely prefer to lose the **steam** generate in her boiler than to run the risk of their burst,at sun sui wah you can splurge on a 10-pound **steam** alaskan king crab with garlic        ||        in some area geothermal **steam** offer a cheap ready-made        ||        cuisine chinese specialty fried quail pea shoot with garlic sauce braised squab whole **steam** fish seat 100 price 4.50-$ 8 parking street sometimes difficult vitals 1559 franklin <nul> at pine street 415 771-2044        ||        she relax breathe the **steam** and close her eye        ||        the airman hesitate but his breath even in the car be **steam**,1
dozen_nn,most of them go home therefore and shortly return with money enough to buy one or two **dozen** stick        ||        fancy the whole **dozen** to be before you as for instance on the bench or settee of some gin or beer shop        ||        then put into the same pot a **dozen** or more sweet potato scrape split and cut in piece        ||        i have thus survey the country on every side within a **dozen** mile of where i live        ||        one bee be of more consequence now than a half **dozen** in midsummer,elvis take fistful of pill and eat fried banana-and-peanut-butter sandwich a **dozen** at a time        ||        a **dozen** half-naked man and woman stand behind him        ||        a second cat but against him and a third and a **dozen** more        ||        at least half a **dozen** robo-pets be available this christmas        ||        aged glossy of hit player be tape to the wall and half a **dozen** customer -- black white hispanic -- be seat at the counter,0
needle_nn,every stitch of your **needle** go through my nerve        ||        here be a **needle** might serve for a genuine stiletto        ||        the mist be fairly freeze and prick like **needle**        ||        i be go to begin my letter by say why i call my letter **needle**        ||        no danger but you will find enough child for the skillfulness of your **needle** be well know,safer and -- thanks to new delivery method without **needle** -- more comfortable        ||        ipa ask as she scrape **needle** off a cactus pad and give it to kadoh        ||        eye of the **needle** follett 3 4        ||        hathaway get his first tattoo at 15 but insist his son tre 16 and jared 11 picture above will wait long to go under the **needle** they have to be 18        ||        ellis glance at the fuel gauge the **needle** stand at half a tank,0
brush_nn,then **brush** over it on one side only a solution of nitrate of silver        ||        here the prostrate tree upturned root vine and **brush** knitted and riv together interrupt the track        ||        as she write in the pavilion the public could not see her **brush** the tear which blot the letter as she be form them and numberless similar instance of refinement perhaps even more genuine for be less obtrusive        ||        on the edge of the wood we could n't get it through the **brush** be the answer        ||        as they pass among the tree reckless as her movement be she take good heed that even the hem of her garment should not **brush** against the stranger 's person,"attachment include a 44-inch mower deck $1,495 sweeper blade/**brush** $1,150 and 48-inch dozer blade $475        ||        a far-reaching branch **brush** its heart-shaped leaf against the window        ||        the death of dr.-i king **brush** away my last sophistical argument against it        ||        ## a **brush** with nature do a mind and body good        ||        he see as they **brush** the dirt away that it be an infant",0
people_nn,the free scope for the energy of the **people**        ||        have you ever see any poor **people** jennie        ||        they be themselves man of the **people**        ||        i like to see **people** when they talk to me        ||        there never be a simple juster movement of a **people**,and the **people** -- oh the **people** -- they be beautiful        ||        new friend mrs.- hansmon -- landlady mrs.- ridinski -- cafeteria mr.- byrd -- florist &; writer henry -- grocery-store man enemy mr.- felix -- turtle soup **people** i know to speak to cashier lunchroom -- female waitress dime store where i buy clock -- man man in bank saleslady -- dress store shoe store man        ||        but what most **people** -- patient and clinician alike -- do n't know be that in more        ||        he shake some **people** 's hand and xx_n ea rly -- xx_j ust nccrly -- shank mine        ||        his prestige -- and not only among his own **people** -- do not diminish it rise,0
rock_nn,dacotah 12 201 richmond 6 207 monteville 5 212 homer 10 222 winona 7 229 fountain city 12 241 mount vernon 14 255 minneiska 4 259 alma 15 274 wabashaw 10 284 nelson 's land 3 287 reed 's land 2 289 foot of lake pepin 2 291 north pepin 6 297 johnstown 2 299 lake city 5 304 central point 2 306 florence 3 309 maiden **rock** 3 312 westerville 3 315 wacouta 12 327 red wing 6 333 thing 's land 7 340 diamond bluff 8 348 prescott 13 361 point douglass 1 362 hastings 3 365 grey cloud 12 377 pine bend 4 381 red **rock** 8 389 kaposia 3 392 <nul> paul 5 397 the scenery on the upper mississippi be repute to be beautiful        ||        cloud sauk rapids 10 76 watab 6 82 little **rock** 2 84 platte river 12 96 swan river 10 106 little fall 3 109 belle prairie 5 114 fort ripley 10 124 crow wing river 6 130 sandy lake 120 250 savannah portage 15 265 across the portage 5 270 down savannah river to <nul> louis river 20 290 fond-du-lac 60 350 lake superior 22 372 crow wing river 130 otter tail lake 70 200 rice river 74 274 sand hill river 70 340 grand fork red river 40 380 pembina 80 460 sandy lake 250 leech lake 150 400 red lake 80 480 pembrina 150 630 stillwater 18 arcola 5 23 marine mills 6 29 fall <nul> croix 19 48 pokagema 40 88 fond-du-lac 75 164 red **rock** 6 point douglass 24 red wing winona 's **rock** lake pepin 30 60 wabashaw 30 90 prairie du chien 145 235 cassville 29 264 peru 21 285 dubuque 8 293 mouth of fever river 17 310 **rock**        ||        stage -- road -- rum river -- indian treaty -- itasca -- sauk rapids watab at midnight -- lodge under difficulty -- little **rock** river character of minnesota stream -- dinner at swan river -- little fall fort ripley -- arrival at crow wing        ||        the **rock** be therefore name oolite or sometimes roestone        ||        morris george pope 1802-1864 the **rock** of the pilgrim,i want his **rock** -- et to go off        ||        at grand targhee 800-827-4433 the **rock** festival **rock**in ' the teton        ||        i paint what i like to paint **rock** -- well once say        ||        i sit in a **rock** chair and smoke a cigar        ||        their father also name pete a 48-year-old cement mixer and part-time **rock** singer and guitarist have have a heart attack,0
tool_nn,the next thing to be attend to be in procure proper **tool** for the purpose which should be of the best quality        ||        the chief **tool** for break the soil be shell and bone        ||        by this simple **tool** his condition be materially improve        ||        give them toy and they will not play with edge **tool**        ||        the plumber use but few **tool** and those be of a simple character the great number of them be similar to those use by other artificer as hammer mallet plane chisel gouge jues <temp> the principal **tool** peculiar to the /z/ trade of the plumber be the bat which be make of beech,visitor management -- training **tool** and staff be a promising area for private assistance        ||        a search **tool** for cheap federal loan be at * * 33 3185 **tool**ong        ||        the **tool** be what he clean out when he leave        ||        be not all art a form of self-extension as in carlyle 's definition of man as a **tool**-using animal        ||        eleven-year-old mary anning take up her **tool** and begin to dig,0
